move_num,color_next,winrate_B,winrate_W,LZ_next_move,variation,actual_next_move,LZ_all_next_moves
168,B,50.08,49.92,R15,"R15 S13 Q12 Q13 O13 S16 S12 M9 B4 S15 O9 G7 F1 E1 B2 B3 A3 A2 A1 F7 E18 B1 C1 E17 G18 B1",R15,R15 Q13 E18 M16 Q12 G18 S12 F18 S13 B4 N15 J16 R16 B15 J15 G8 B3 P14 M9 S16 P13 R11 Q18 Q17 K11 R17 S15 A16 K9 K16 P12 B18 S3 G7 H10 D19 K18 L18 O9 E17 F17 C15 M14 B2 D18 B19 F11 S11 E1 B5 C19 S18 G16 J10 A5 J17 A4 J12 A15 N14 O13 H15 O18 L13 Q11 P10 F19 G4 B14 S17 J9 E19 P18 L9 A2 A18 A14 K17 H9 K19 L14 R3 H19 J18 O14 S10 K13 L12 P5 L11 N19 Q10 T15 F1 B16 T4 L7 G9 G19 L6 M13 B1 A3 L5 O19 P8 P9 O5 A17 P11 T13 M19 L10 Q9 O12 R9 N13 L19 R19 J19 O10 F14 B17 N6 T14 S9 O7 O3 T9 B6 N7 J8 J13 O6 P7 O11 P6 E14 M6 Q19 C4 R8 Q8 O1 T5 O8 T17 T16 M2 F12 P19 C18 T8 T10 T11 L3 H1 L2 B13 G1 P1 O4 A8 O2 N1 M1 F3 P15 A9 T12 A13 D10 T18 D5 A6 R4 A1 A10 S19 A7 C12 S7 B8 E12 P16 T6 C1 B11 R2 K2 Q3 K1 T19 Q1 J1 A19 G2 A12 L1 F7 
169,W,47.76,52.24,S13,"S13 Q12 Q13 O13 S16 S12 M9 B4 S15 O9 G7 F1 E1 B2 B3 A3 A2 A1 B1 C1 F7 D2 F17 G16 G18 L6 N7 O8 L7 M6 T12 T11 T13 S11 O5 Q17 Q18 B15 B16 H15 C15 B14 O7 O3 J15 J12 K11 F11 H10",Q13,S13 Q13 S12 
170,B,64.75,35.25,S12,"S12 S13 S15 Q12 O13 T12 T14 P11 O9 P9 Q10 O10 Q9 O8 M9 R9 Q8 S9 T9 N7 O9 N14 O14 N9",S12,S12 S15 S11 Q12 O13 R11 R17 M16 
171,W,65.42,34.58,S13,"S13 S15 Q12 O13 T12 T14 P11 O9 P9 Q10 O10 Q9 O8 M9 R9 Q8 S9 T9 R11 T10 N7 O9 N14 O14 N9",S13,S13 M9 
172,B,65.77,34.23,S15,"S15 O13 N14 P10 S10 N13 M14 M13 L14 R9 S9 M9 L12 O10 P11 Q12 O9 S11 P9 T12 N15 M16 T14 Q10 P12 P13 T15 P16 P15 Q17 S17 R17 S18 S19",O13,S15 O13 Q12 R17 N14 N15 
173,W,51.30,48.70,S16,"S16 Q12 M9 B4 O9 S15 T15 F1 E1 B2 B3 A3 A2 A1 B1 C1 G7 G4 B1 S17 R17 C1 T14 P10 B1 R16 T16 C1 O10 O11 B1 E18 E17 C1 P11 P12 B1",S16,S16 Q12 N14 P16 Q11 P11 M9 
174,B,53.45,46.55,Q12,"Q12 M9 B4 S15 O9 G7 F1 E1 B2 B3 A3 A2 A1 B1 C1 F7 D2 F17 G16 G18 L6 N7 O8 L7 M6 T12 T11 T13 S11 O5 Q17 Q18 B15 B16 H15 C15 B14 O7 O3 J15 J12",Q12,Q12 S17 S15 R17 
175,W,51.91,48.09,M9,"M9 B4 S15 O9 G7 F1 E1 B2 B3 A3 A2 A1 F7 G18 B1 C1 P12 E18 D18 P13 B1 B15 B16 C1 S11 T12 B1 A16 C15 C1 P11 Q11 B1",B4,M9 B4 G7 P12 T12 
176,B,42.79,57.21,E18,"Q17 Q18 S17 R17 S15 T15 R16 T16 P13 S18 E18 E17 G18 M9 O9",S15,E18 Q17 S15 B5 R17 S17 A5 A6 G18 M9 B6 M16 F18 Q18 G7 N15 B15 L9 J15 J16 O9 A15 L10 E17 E19 B18 S3 S18 K16 G8 K18 F17 A16 G4 C15 B14 P13 R3 H19 A14 K11 A17 L6 C4 H15 R16 G16 D19 K9 A7 H10 A18 L5 D18 L7 B19 L18 T18 F11 F19 B16 K17 P14 A8 R19 L11 T16 T12 J10 L13 T17 B17 T15 F1 O8 J12 K19 K13 H9 J18 C19 P10 G19 T13 T4 P16 L12 P11 J19 J13 D10 N14 B3 L14 M13 P19 A13 A9 J9 O5 B8 J17 P18 S11 M14 O4 S19 O14 P5 O11 N19 O18 M6 N6 T10 T11 P12 F12 O7 T9 O19 O10 N7 E1 O6 Q9 S10 O3 N1 B13 J8 A10 Q11 P15 R8 L19 O12 N13 R11 P9 O2 B1 O1 Q8 F14 C18 P7 K2 P8 C12 E14 R9 M19 Q19 L2 T14 G1 M1 S7 G9 E12 P6 Q10 B2 S9 G2 A4 J1 M2 A12 C1 T5 L3 T6 B11 R4 K1 T8 A2 D5 F3 H1 A3 Q3 L1 A19 R2 P1 T19 Q1 A1 F7 
177,W,30.97,69.03,T15,"T15 Q17 Q18 S17 R17 R16 T16 P13 S18 B5 M9 O9 F18 L7 G7 G4",T15,T15 M9 G7 
178,B,33.62,66.38,J15,"P13 M9 E18 E17 G18 B6 S17 S18 B5 A5 C4 B3",E18,J15 G18 P13 Q17 M16 M9 S17 E18 B5 T14 R17 A5 B6 F18 P14 A6 E17 L9 B15 Q18 N15 T12 J16 G7 G8 L10 A15 K16 F17 T16 G16 K18 H19 S18 K9 F19 E19 O9 B18 R16 T18 K11 C15 C4 L6 A16 H15 R3 T17 P12 A9 A17 H10 C19 B14 B19 L18 G4 L7 D18 K17 E1 S3 T13 B16 M14 A8 F11 L11 J19 J12 N14 A14 N6 T4 K19 N19 P5 P11 B8 P15 O7 B3 P18 J10 L5 D19 O5 K13 J17 O14 L13 R19 B17 F1 P19 P10 O12 O3 F14 S11 J13 G19 L14 O10 M13 P8 D10 P16 S19 O18 T11 L19 C18 O6 Q8 Q19 O11 S10 J18 M6 T10 R9 Q9 O19 A7 O4 T9 R11 H9 L12 A18 R8 A13 M19 N7 T6 G9 B13 L3 O8 J9 G1 N1 B1 J8 F12 Q10 T5 P9 Q11 T19 P7 P6 A19 L2 M1 N13 O1 A4 S9 A10 E12 C12 J1 R4 Q3 O2 K2 T8 M2 S7 E14 C1 R2 G2 K1 A2 A12 Q1 L1 H1 B11 P1 D5 A3 F3 B2 A1 F7 
179,W,34.92,65.08,E17,"E17 G18 M9 B15 D18 C15 B18 A17 A18 G19",M9,E17 M9 B6 G7 B5 
180,B,37.98,62.02,S17,"S17 R17 R16 T16 E17 D18 P13 S18 B15 B18 A17 A18 C19 D19 G18 B16",O9,S17 Q17 E17 T14 B15 B5 J16 D18 R17 G18 T12 B18 B6 A5 O9 Q18 P13 F18 C19 P14 C15 J15 B19 A16 A6 K18 G16 M16 G7 S3 K16 D19 A15 T16 B14 L6 A17 L18 A14 G8 N15 T13 A18 L7 P9 K17 R16 B16 T18 O10 P16 L9 H15 K19 L14 P10 E19 J17 F17 E1 M14 F11 H19 S11 L11 G4 S18 G19 K13 R3 B3 F1 O14 K11 C4 M13 F19 P8 L12 P12 L13 Q9 L5 J18 N19 N14 F12 B1 K9 L10 P15 T4 Q10 J12 R19 A8 H10 T11 M6 P5 N7 A9 P19 G1 L19 O7 J13 D10 T17 O12 S10 P18 Q19 N6 O3 O8 O11 O6 A13 T10 S19 M19 O18 H9 O2 T9 E14 E12 J9 L3 F14 B17 O19 N13 J10 P11 J19 C18 P6 O5 G9 O4 B13 M2 A4 S9 A2 K2 L2 B11 T8 A10 R11 Q11 T19 A12 N1 L1 C1 R4 R9 R8 A3 O1 T6 B8 J8 Q8 M1 G2 F3 H1 T5 P7 J1 S7 C12 P1 B2 K1 Q1 A19 D5 R2 Q3 A1 A7 F7 
181,W,24.35,75.65,E17,"E17 G18 B6 B5 A5 C4 B3 A9 G7 G4 A6 A8 B8 S17",B6,E17 B6 D18 B5 G18 B15 
182,B,27.68,72.32,B5,"B5 A5 S17 R17 R16 T16 C4 B3 P13 S18 E17 D18 B15 D19 G18 B18 B16",B5,B5 S17 E17 T14 R17 B15 D18 Q17 B18 Q18 B19 C19 G18 C15 D19 
183,W,24.23,75.77,A5,"A5 C4 A6 Q17 Q18 S17 R17 R16 T16 T14 T13 T17 T14 P13 S18 T12 T18",A5,A5 E17 
184,B,25.75,74.25,C4,"C4 A6 S17 R17 R16 T16 S18 S19 T14 T13 E17 D18 T18 R19 B15 B18 A17",C4,C4 S17 E17 A6 B15 D18 B18 Q17 R17 G18 J16 B19 G7 T14 J15 A9 C19 
185,W,28.11,71.89,A6,"A6 S17 R17 R16 T16 S18 S19 T14 T13 T18 T14 Q17 Q18 P14 T12 S11 T17 T11 T19 E17 B19 B15 A18",B3,A6 B3 B2 E17 A9 D18 A3 B15 A4 G7 
186,B,22.80,77.20,Q17,"Q17 Q18 S17 R17 R16 T16 S18 S19 T14 T13 T18 T14 T12 T17 P13 T19 E17 D18 B15 D19 G18 B18 B16 B17 J16 J15",D18,Q17 B15 S17 T14 E17 G18 A6 A9 B18 J16 R17 D18 B19 G7 C15 M16 A4 P13 D19 L7 J15 
187,W,58.48,41.52,E17,"E17 F17 C15 A16 B16 B18 C18 C19 B19 A19 B17 A17 A15",E17,E17 C18 B19 B18 B15 C15 C19 E14 N14 F14 B14 F17 A18 A9 K2 G7 F18 L3 P14 P12 P13 T12 O14 S17 S18 F7 A17 S11 G18 A6 B16 B8 P1 T18 K16 P16 P15 A8 H10 E1 Q9 L7 K18 T14 Q17 M16 F11 J16 T5 T16 Q18 Q11 T17 J15 N1 K17 P5 P18 L6 N7 L18 F1 T13 Q10 R9 O1 J12 O4 H15 J18 G9 L9 M19 A4 T11 J17 O11 S19 M2 O6 A2 N19 Q8 T6 O19 P19 M1 L10 P6 A7 O8 A3 K19 P11 B1 P7 Q19 G8 A16 J1 B2 J8 O5 P9 L5 R19 H9 R11 L1 R8 T10 O12 J10 T19 S9 H19 D19 G1 L2 K9 M6 O18 L11 J19 N13 A15 O7 J9 P8 D10 K1 L19 F12 L12 P10 S10 T8 E19 T9 C1 M13 K11 L13 O10 B13 M14 H1 B17 A12 A13 J13 G19 A10 A14 A1 G16 E12 L14 A19 K13 F19 
188,B,39.68,60.32,F17,"F17 C15 A16 B14 A17 C18 A14 A13 A15 A18 B18 B17 A19 B15 B13 D19",G18,F17 G18 C18 
189,W,15.43,84.57,C18,"C18 B15 F17 G16 F18 F19 C15 K18 K16 H19 J19 J18 G19 S17",C18,C18 C15 F17 B18 
190,B,15.33,84.67,H19,"B15 C15 A18 A16 S17 R17 R16 T16 B16 B17 B14 A17 T14 T13 T17 T14 P13 S18",C15,H19 B15 K18 G16 Q17 C15 S17 J16 A9 T14 A6 R17 G7 
191,W,14.96,85.04,B15,"B15 B14 A16 G16 H15 A18 A17 A14 B18 B16 A19 A15",B15,B15 F17 D19 
192,B,15.91,84.09,B14,"B14 A15 G16 B17 J16 J15 H15 K16 S17 R17 R16 T16 T14 T13 T17 T14 P13 S18",B14,B14 H19 A18 G16 J16 C19 K18 A14 S17 A9 A6 A15 J15 B17 G19 Q17 G4 A17 L18 G7 R17 P13 L9 J18 M16 B16 H15 R3 S3 D10 A4 O12 B19 F19 T14 K19 Q8 F11 T12 L10 J19 F17 P12 B18 L12 P11 P10 T8 F18 E12 S11 J13 L7 A16 T9 R11 L6 S10 P8 N1 F12 T4 P19 L19 G2 K13 P18 P16 E1 K16 Q3 T11 M2 L13 K1 O6 O1 P14 J1 G1 A2 P7 O11 T10 F1 Q11 Q18 P9 F14 S9 A3 O7 L1 H1 M14 M13 R9 B1 Q10 O2 O3 R8 K2 B13 L3 O10 J8 O14 C12 P6 N15 O8 A10 T6 Q9 N13 O4 S19 M6 A1 Q19 T16 L11 R2 S7 M1 P5 L2 N14 G9 H10 R4 P1 K17 L5 K11 O19 N6 B2 A12 B11 F3 S18 T5 H9 T13 O18 Q1 D5 B8 M19 J12 A8 R19 T19 R16 P15 O5 J9 E14 L14 T18 J17 C1 G8 N19 E19 T17 N7 A13 K9 A7 J10 D19 F7 A19 
193,W,15.90,84.10,A15,"A15 G16 B17 S17 R17 R16 T16 S18 T14 S19 T18 Q17 Q18 P18 P19 P13 T17 P14 O18",F17,A15 A16 F17 D19 
194,B,17.16,82.84,G16,"G16 F18 F19 A16 J16 J15 H15 K18 H19 K17",G16,G16 S17 F18 
195,W,14.37,85.63,F18,"F18 F19 E19 H19 J18 G19 J19 D19 C19 E19 A15 A9 A6 A8 B8",F18,F18 A15 K18 G7 K16 A16 
196,B,13.31,86.69,F19,"F19 E19 D19 K18 G19 C19 E19 A16 A9 N7 O8 M6 L5 L7 A6 A7",F19,F19 G19 S17 H19 Q17 T14 A6 R17 M16 Q18 J16 G7 J19 J15 
197,W,12.12,87.88,E19,"E19 G19 K18 H19 J19 S17 R17 R16 T16 S18 S19 T14 T13 T18 R19 Q17 Q18 P18 O14 N14 P15",H19,E19 A15 A16 H19 G7 K18 D19 
198,B,17.65,82.35,G19,"G19 C19 J16 J15 H15 J17 K16 K18 M16 N17 N15 L18 M14 K17",G19,G19 S17 
199,W,15.87,84.13,A15,"A15 S17 R17 R16 T16 J16 J15 T14 T13 H15 J17 S18 S19 T18 T14 T12 T17 K16 K18 M16 N17 N15",A15,A15 C19 A16 E19 
200,B,17.28,82.72,J16,"J16 J15 H15 J17 K18 K16 M16 N17 Q17 Q18 S17 R17 R16 T16 T14 T13 T17 T14 P13 S18 T12 T18",J16,J16 S17 J15 Q17 C19 A9 T14 A17 R17 A18 M16 A6 Q18 G7 B17 K16 
201,W,16.18,83.82,J15,"J15 H15 J17 K18 K16 M16 N17 Q17 Q18 S17 R17 R16 T16 S18 T14 S19 T17 P18 P19 N15 K17",J15,J15 K16 K18 J17 K17 G7 L18 
202,B,15.26,84.74,H15,"H15 J17 K18 K16 M16 N17 Q17 Q18 S17 R17 R16 T16 S18 T14 S19 T17 P18 P19 N15 K17 L18",H15,H15 S17 C19 A17 M16 Q17 R17 A18 
203,W,12.53,87.47,J17,"J17 K18 K16 M16 N17 Q17 Q18 S17 R17 R16 T16 S18 T14 S19 T17 P13 T18 P18 P19 P14 O18",J17,J17 K18 K16 K17 
204,B,35.60,64.40,K18,"K18 K16 M16 N17 Q17 Q18 S17 R17 N15 N14 O14 K17 R16 T16 S18 S19 T14 T13 T18 R19 P18 P19 P13 O18 T12 T19 P14",L7,K18 A6 K16 S17 Q17 Q18 M16 C19 R17 T14 A17 A9 A18 B18 G7 P13 E19 A4 B17 L7 N19 
205,W,7.75,92.25,G7,"G7 G4 R17 A9 A6 A8 B8 C19 B19",L6,G7 L6 L9 R17 A9 N7 
206,B,23.11,76.89,Q17,"Q17 Q18 S17 R17 R16 T16 K16 K18 T17 T14 P13 S18 M16 N17 N15 L18",L9,Q17 M6 L9 S17 M16 T14 K16 G7 R17 A17 C19 
207,W,14.33,85.67,G7,"G7 G4 K11 S17 R17 R16 T16 T14 T13 T17 T14 P14 S18 T12 T18",L10,G7 L10 K11 N7 K9 
208,B,32.39,67.61,Q17,"Q17 P16 P15 Q18 T14 T13 S17 R17 R16 T16 T17 T14 P13",N6,Q17 G7 M6 S17 T14 K16 K9 M16 A17 A9 C19 R17 
209,W,5.83,94.17,G7,"S17 A9 B8 C19 B19 E19",G7,G7 S17 R17 A9 T14 K9 C19 B17 M16 K16 N15 
210,B,8.97,91.03,Q17,"G4 R17 M16 N17 N15 K16 A9 A6 A8 B8 A17 A18",G4,Q17 G4 R17 K18 S17 K16 M16 A17 C19 
211,W,4.89,95.11,S17,"S17 A17 A18 B18 C19 A19 B17 A14 B19 B16 A9",T14,S17 R17 T14 A9 M16 T16 K16 K9 Q17 C19 L18 O5 B17 N15 
212,B,11.06,88.94,K9,"K9 J9 M16 N17 N15 K16 R17 S17 S18 Q18 A9 A6",K16,K9 K18 J9 K16 A9 A17 C19 M16 R17 H10 S17 A6 Q17 A18 B18 
213,W,8.86,91.14,K18,"K18 A6 A7 A9 B8 M16 N17 N15 M14 A17 A18",K18,K18 L18 M19 L19 K19 N14 M16 
214,B,9.03,90.97,L18,"L18 M19 Q18 Q17 M16 N17 N15 L19 M14 K17 A17 A18 B18 C19 A19 B17 A14",H10,L18 A6 M16 A17 C19 R17 S17 K9 Q17 A9 N15 A4 J9 
215,W,4.06,95.94,J12,"K9 J12 H9 M16 N17 N15 L18 M14 K17 R17 S17",H9,J12 K9 J10 H9 J9 G9 F11 
216,B,7.81,92.19,J9,"J9 K9 G9 G8 A9 A6 A8 B8 J12",M16,J9 L18 M16 G9 R17 K9 J12 A6 C19 S17 A9 Q17 A17 F11 
217,W,5.69,94.31,N17,"N17 J9 K9 G9 G8 N15 L18 A9 A6 A8 B8 M14 K17",N17,N17 L18 N15 K17 
218,B,6.47,93.53,J9,"J9 K9 N15 L18 G9 G8 A9 A6 A8 B8 M14 K17 R17 S17",J9,J9 N15 S17 R17 K9 C19 J12 A17 A6 Q17 A9 L18 G9 J10 
219,W,5.68,94.32,K9,"K9 G9 G8 N15 L18 A9 A6 A8 B8 M14 K17 R17 S17 S18 T18",K9,K9 J10 G9 
