move_num,color_next,winrate_B,winrate_W,LZ_next_move,variation,actual_next_move,LZ_all_next_moves
0,B,43.38,56.62,Q4,"Q4 D16 Q16 D4 F17 O17 F3 O3 C14 D14 D13 E14 C16",Q16,Q4 Q16 D16 D4 R4 C4 R16 C16 Q17 Q3 D17 D3 
1,W,43.41,56.59,D4,"D4 Q4 D16 C17 D17 C16 D15 C14 C15 B15 C18 D14 C7 F14 B18 O3",C17,D4 Q4 D16 
2,B,44.23,55.77,D4,"D4 Q3 R5 O4 M3 R17 R16 Q17 O17 P17 P16 O18 N5 O5 N6",R4,D4 Q4 Q3 C4 P4 D3 R4 D16 
3,W,44.04,55.96,D3,"D3 C5 F4 O3 R17 R16 Q17 O17 P17 P16 O18 Q9 N17 O16",D3,D3 D4 C4 C3 
4,B,44.28,55.72,C5,"C5 F4 O4 R17 Q17 R16 R14 R15 Q15 S14 R18 S18 S15 Q18 S17",C5,C5 P4 O3 O4 D5 
5,W,43.99,56.01,E4,"E4 O4 R17 Q17 R16 R14 R15 Q15 S14 R18 S18 S15 Q18 S17",P3,E4 F4 P3 C4 P4 R17 
6,B,45.29,54.71,Q3,"Q3 P4 Q6 L4 E4 C4 B5 E3 F4 G3 G4 H3 H4 J3 D10 R17",Q3,Q3 E4 Q5 N3 M3 N4 F4 Q6 D16 
7,W,45.65,54.35,P4,"P4 Q6 L4 E4 E3 F4 G3 O5 R17 Q17 R16 R14 R15 Q15 S14 R18 R13 Q14 S12 S17 S16 T16 S15 M4 M3",P4,P4 C4 
8,B,46.01,53.99,Q6,"Q6 M4 E4 E3 F4 G3 G4 H3 H4 J4 F3 F2 E2 D2 G2 E1 J3 H2 J2 G1 L4 J5 M5 L5 L3 L6 N4 M6",Q6,Q6 R6 E4 
9,W,44.52,55.48,M4,"M4 E4 E3 F4 G3 G4 H3 H4 J4 F3 F2 E2 D2 G2 E1 J3 H2 J2 G1 L4 J5 M5 L5 L3 L6 N4 M6 N5",L4,M4 L4 C4 F4 L3 R17 H4 E4 M3 R5 
10,B,46.54,53.46,E4,"E4 F2 R14 C4 B4 B3 D4 C3 D8 C10 D16 D17 F16 D15 O5 N4 M5",E4,E4 F4 O5 N2 D16 
11,W,45.83,54.17,F2,"F2 R14 C4 B4 B3 D4 C3 D8 C10 D16 D17 F16 D15 O5 N4 M5",F3,F2 E3 C4 
12,B,47.24,52.76,O5,"O5 Q2 R2 P6 P5 Q4 R3 Q5 R5 N3 F4 E3 G4 P7 Q7",E3,O5 E3 F4 G5 L5 N5 D16 K5 C14 
13,W,46.20,53.80,E2,"E2 F2 G2 D2 F1 C3 F4 E5 R17 Q17 R16 R14 R15 Q15 S14 R18 S18 S15 Q18 S17 R19 S16 R18 S13 Q14 R13 O17 O14 M16 O6 R8 R7 S7",E2,E2 R5 
14,B,47.41,52.59,D4,"D4 C3 D2 C2 F2 D1 G3 R14 R12 P14 N16 R8 R7 Q8 P12 P6 R16 N12 H6 N14 L16 S15 O10",D4,D4 F2 F4 D2 
15,W,47.13,52.87,C3,"C3 D2 C2 F2 D1 G3 R14 R12 P14 O16 R8 R7 Q8 P12 P6 R15 S15 S16 N15 N16 M15 L17",C3,C3 C2 D2 
16,B,47.22,52.78,D2,"D2 D1 F2 C2 G3 R14 H6 O17 Q14 Q13 P14 R15 R16 N16 P18 P13 O13 O12 N14 N12 K16 P17 Q18 L15 Q15 L16",D2,D2 F2 
17,W,47.09,52.91,C2,"C2 F2 D1 G3 R14 H5 O17 Q14 Q13 P14 R15 R16 N16 P18 P13 O13 O12 N14 N12 P17 R8 R7 Q8",C2,C2 D1 
18,B,46.99,53.01,F2,"F2 D1 G3 R14 H5 O17 Q14 Q13 P14 R15 R16 N16 P18 P13 O13 O12 N14 N12 P17 R8 R7 Q8 J17",F2,F2 D16 
19,W,47.10,52.90,D1,"D1 G3 R14 H5 O17 Q14 Q13 P14 R15 R16 N16 P18 P13 O13 O12 N14 N12 K16 P17 Q18 L15 Q15 L16 K17 F17 G16 F16 G17 F15 C16",D1,D1 E1 
20,B,47.11,52.89,G3,"G3 R14 H5 O17 Q14 Q13 P14 R15 R16 N16 P18 P13 O13 O12 N14 N12 K16 P17 Q18 L15 Q15 L16 K17 F17 G16 F16 G17 F15 C16 D16 C15",G3,G3 D16 
21,W,46.61,53.39,R14,"R14 H5 O17 Q14 Q13 P14 R5 R6 Q5 S5 R16 R13 R15 Q12 Q17 P6 S13 P13 S12 C12",Q14,R14 O17 R17 R5 R8 Q8 
22,B,47.80,52.20,H5,"H5 O17 P14 P13 O14 Q13 O16 R17 R16 Q17 P16 N17 P17 P18 O18 Q18 N18",H6,H5 H6 Q12 J4 Q11 K5 J5 J6 O16 Q10 R12 N10 O17 R11 O11 O5 K6 N11 O10 N9 Q9 
23,W,46.62,53.38,O17,"O17 P14 Q13 P13 P12 Q15 Q11 R9 Q18 N16 N17 M16 L18 C15 E16 C12 K16 O12",O17,O17 O16 R5 H4 
24,B,47.10,52.90,O5,"P14 P13 O14 Q13 Q15 O13 O16 R5 R6 Q5 S5 P17 Q17 L17 P6 R9 M4 M3 N3 N4",O16,O5 P14 N2 R14 R12 C14 O6 M4 C13 C12 
25,W,44.56,55.44,N16,"N16 O15 P17 Q15 R18 Q11 R8 R7 S14 R17 S18 P13 Q12 P12 R11 R12 Q13 R10 S11 Q10",N16,N16 P17 H4 R17 
26,B,44.63,55.37,O15,"O15 P17 Q15 R18 Q11 R8 R7 S14 R17 S18 P13 Q12 P11 R11 R10 S10 R12 S11",O15,O15 P17 P14 
27,W,44.68,55.32,P17,"P17 Q15 R18 Q11 S14 R17 S18 P13 R8 R7 S7 S6 Q12 P11 R11 R10 R12 S10 P12 O12 O11 O10 N11 N12 M12 M13 M11 L13",P17,P17 Q17 P18 
28,B,44.61,55.39,Q15,"Q15 R18 R14 D12 L16 G16 M18 N18 M17 N17 M14 R13 Q13",Q15,Q15 Q17 
29,W,44.61,55.39,R18,"R18 R14 D12 L16 R13 Q13 R12 P14 R8 R7 Q8 O6 Q12",R10,R18 R17 Q17 H4 R8 
30,B,47.63,52.37,R8,"R8 R18 R14 R13 Q13 P14 S14 R12 P13 O14 N15 O12 M16",N2,R8 O5 Q17 R12 L17 
31,W,46.68,53.32,Q2,"Q2 R2 O2 R8 R18 R14 N3 R12 C11 D12 D11 E12",N3,Q2 R18 N3 R5 H4 R14 R17 
32,B,49.85,50.15,M3,"M3 N4 P2 Q4 R3 O2 O1 O3 M2 Q2 P1 M4 Q17 K17 R12 R5 R2",M3,M3 Q17 R8 
33,W,50.13,49.87,N4,"N4 P2 R18 O2 R14 O13 M7 R8 Q11 O11 J7 S15 S14 L16 M16",Q2,N4 M4 R5 Q4 Q2 
34,B,53.91,46.09,N4,"O3 O2 N4 N5 M5 O5 L5 S3 R8 R18 R14 R13 Q13 P14",N4,N4 O3 R2 M4 R8 
35,W,52.86,47.14,N5,"R5 Q5 Q4 R3 R6 R7 S7 Q7 S8 S4 S5 T5 S6 R2 O5 P2 O2 Q1 O3 M4 N6 Q9 L6 N8 Q10 P10 P11 O11",N5,N5 R5 Q4 O2 R18 S3 P6 O5 
36,B,54.56,45.44,O3,"O3 O2 O1 P2 M5 O5 R8 M4 K3 O4 N3 M6 Q17 K17 R12 P10 P12 S3 S4 R3 P8 N10 N8",M4,O3 M4 R2 Q17 O5 M5 R8 
37,W,52.31,47.69,M5,"M5 Q17 K17 R2 O2 L2 O4 Q1 P2 R8 J3 J2",Q4,M5 Q4 R5 
38,B,54.97,45.03,R3,"R3 R5 Q5 R6 R7 S7 O5 R2 S4 R8 Q7 S5 T5 S6 S2 T3 T2 P2 S1",R3,R3 Q17 M5 O5 R5 
39,W,55.02,44.98,R5,"R5 Q5 R6 R7 S7 O5 P5 Q7 S8 O6 R2 Q17 K17 C15 E16 D12 E14 C13 H7 G7 G8 H8",R5,R5 M5 
40,B,57.14,42.86,Q5,"Q5 R6 R7 S7 O5 P5 Q7 S8 O6 R2 Q17 K17 C15 E16 D12 E14 C13 H7 G7 G8 H8 J7 J8 K8 K9",Q5,Q5 S5 R2 
41,W,57.04,42.96,R6,"R6 R7 S7 O5 P5 Q7 S8 S4 S5 T5 S6 P6 R2 S2 P2 N6 R18 T3 S1 L16 N15 R14 G16 D12 N14 M17",R6,R6 S5 S6 S4 O5 R2 
42,B,57.65,42.35,R7,"R7 S7 O5 S4 Q8 P5 P6 S3 S6 S5 S8 O6 O4 R14 Q17 O13 S15 N15 O7 S14 P13",R7,R7 O5 Q7 R2 P5 
43,W,57.11,42.89,S7,"S7 O5 S4 Q8 P5 P6 S3 S6 S5 S8 O6 O4 R14 Q17 O13 S15 N15 O7 S14 P13",S7,S7 S4 S5 
44,B,58.04,41.96,O5,"O5 S4 Q8 P5 P6 R2 S6 S5 S8 O6 O4 R18 O7 N6 N7 L5 L7",Q7,O5 Q7 Q8 P5 R2 
45,W,50.47,49.53,S8,"S8 O5 R2 Q17 K17 Q10 R11 R9 R8 Q8 S9 C13 C15 E13 C11 D16 D17 E16 B14 B13 E11",S4,S8 R2 S4 
46,B,60.39,39.61,S3,"S3 S5 R2 P2 S8 R1 T3 T2 S1 Q1 T7 T4 S6 S2 Q17 M5 L5 K17 R12 Q12 R13 R14 Q13 P14",S3,S3 R2 S8 O5 Q17 
47,W,59.73,40.27,S5,"S5 R2 P2 S8 R1 T3 T2 S1 Q1 T7 T4 S6 S2 M5 R14 Q17 K17 S15 P10 P13 N10 M8 P14 M16 N15 O14",S5,S5 S6 S8 
48,B,59.95,40.05,R2,"R2 P2 S8 R1 T3 T2 S1 Q1 T7 T4 S6 S2 M5 R14 Q17 K17 Q11 R11 Q10 S16 R12 S12 Q12 S13 S17 R16 R17 P13",R2,R2 S8 O5 P2 P5 Q17 
49,W,59.07,40.93,P2,"P2 S8 R1 T3 T2 S1 Q1 T7 T4 S6 S2 M5 R14 Q17 K17 Q11 R11 Q10 S16 R12 S12 Q12 S13 S17 R16 R17 P13 O13 P12 M16",P2,P2 O2 R8 O5 P1 
50,B,58.80,41.20,S8,"S8 R1 T3 T2 S1 Q1 T7 T4 S6 S2 M5 R14 Q17 K17 Q11 R11 Q10 S16 R12 S12 Q12 S13 S17 R16 R17 P13 O13 O12 N13 Q9 R9",S8,S8 P5 T2 O5 S1 
51,W,57.77,42.23,R1,"R1 T3 T2 S1 Q1 T7 T4 S6 S2 M5 R14 Q17 K17 L16 K16 M16 M18 N15 K14 R12 Q12 R11",R1,R1 T6 T2 R8 S9 T4 T3 
52,B,58.41,41.59,T3,"T3 T2 S1 Q1 T7 T4 S6 S2 M5 R14 Q17 K17 P13 Q12 P12 P11 Q13 R12 Q11 R11 Q10 Q9 P10 O11",T2,T3 S1 Q17 T2 O5 T7 R9 M5 T4 
53,W,73.71,26.29,S1,"S1 T7 S2 S6 T3 M5 R18 R17 S18 R14 R13 Q13 P14 Q12 S14 R15 R12 Q11 Q10",S1,S1 R8 
54,B,75.42,24.58,T7,"T7 S2 S6 T3 M5 R18 L16 S14 N15 S16 C13 F16 C15 D12 C12 D10 E17 D16 E16 D15",T7,T7 O5 Q17 M5 
55,W,75.68,24.32,S2,"S2 S6 T3 M5 R18 P13 P10 R12 N10 C12 M8 C15 F17 F16 E17 G16 D15 C16 D16",S2,S2 S6 M5 R14 R18 T6 
56,B,76.51,23.49,S6,"S6 T3 M5 R18 P13 P10 R12 N10 C12 M8 C15 F17 F16 E17 G16 D15 C16 D16 B17 C14 B14",S6,S6 Q17 T3 O5 M5 
57,W,76.43,23.57,T3,"T3 M5 R18 P13 P10 R12 N10 C12 M8 C15 F17 F16 E17 G16 D15 C16 D16 B17 C14 B14",T3,T3 M5 R18 R14 
58,B,77.02,22.98,M5,"M5 R18 P13 P10 R12 N10 C12 M8 C15 F17 F16 E17 G16 D15 C16 D16 B17 C14 B14 B18",M5,M5 Q17 O5 R14 L16 L17 P10 
59,W,77.00,23.00,R18,"R18 R17 S18 R12 H7 R14 G6 H5 F4 F5 G4 G5 H4 H2 J4 K3 K4 J3 J7 K6 L8 J6 O9",R18,R18 R14 R17 S14 Q17 
60,B,78.16,21.84,R17,"R17 S18 R12 H7 R14 G6 H5 F4 F5 G4 G5 H4 H2 J4 K3 K4 J3 J7 K6 L8 J6 O9",R12,R17 P13 L16 R12 Q12 Q11 P12 R14 P11 O11 D16 O13 O12 N15 
61,W,76.56,23.44,S14,"R13 Q12 S12 S11 S14 T12 S13 P13 S16 R17 S17 Q18 Q17 R16 S18 N17 M16 N18 O18 L17 M14",D11,S14 R13 Q12 H7 R14 S12 N7 G6 O5 F6 
62,B,81.43,18.57,R14,"R14 F16 C13 H7 J7 G6 H5 J8 H8",D16,R14 D16 L16 C13 M14 P12 P13 R17 L17 N15 N11 
63,W,81.01,18.99,D17,"D17 F16 D15 R14 E16 L17 M17 L16 M10 O10 N15 N14",D17,D17 C16 
64,B,80.79,19.21,F16,"F16 E16 E15 E17 H15 C14 R14 M10 O10 K10 L16 L6 M6 L7 J7 M7",F16,F16 E16 
65,W,80.34,19.66,E16,"E16 E15 E17 H15 H7 R17 S18 R14 G6 H5 K7 L9 M6 L6",D15,E16 S14 D15 Q12 H7 R13 E17 O5 D14 
66,B,82.29,17.71,R14,"R14 E16 L17 M17 L16 M10 O10 N15 N14 M14 N13 F15 M15 K10 N18",R14,R14 L17 L16 P12 P13 E15 R17 E12 N11 E13 N15 
67,W,81.12,18.88,E16,"E16 L17 M17 L16 M10 O10 N15 N14 M14 N13 F15 M15 K10 N18 M18",M10,E16 M10 M11 H7 M9 N10 O9 N7 Q12 Q13 N9 K16 L10 O5 E15 
68,B,82.70,17.30,L17,"L17 M17 L16 O10 D12 E12 E13 D13 C12 C11 C16 E16 E15 E17 D14 C13",L16,L17 O10 D12 L16 E12 K10 C13 E13 E15 N10 L10 M18 D13 K9 
69,W,79.83,20.17,O10,"O10 M18 M17 L17 N18 M16 N17 N15 E16 M8 K10 D10 C10 C9 C11",K10,O10 K10 E16 Q13 O9 E15 L8 P10 L6 
70,B,82.71,17.29,M18,"M18 M17 L17 N18 O10 N15 N14 M14 N13 H16 M13 L14",M18,M18 O10 D12 L10 E15 C13 E12 L9 E13 N10 
71,W,81.15,18.85,M17,"M17 L17 N18 D12 E11 E12 F11 C11 C10 C12 D9 C16 E16 E15 E17 B15 F15 E14 G16 F14 G15",M17,M17 S17 S16 E16 N18 O10 J7 N17 
72,B,81.30,18.70,L17,"L17 N18 D12 E12 C11 E11 C10 D13 C12 C13 E9 F9 E8 H16 M16 N17 N15 H14",L17,L17 N18 E15 
73,W,81.32,18.68,N18,"N18 D12 E12 C11 E11 C10 D13 C12 C13 E13 D9 C9 D8 C8 D7 B5 H7",N18,N18 S16 
74,B,82.20,17.80,D12,"D12 E12 E11 E13 D10 C11 C10 B11 B10 D13 F11 O10 K8 H10 G12 M8",N10,D12 M16 O10 E12 L10 C13 E13 L9 N10 E15 L11 
75,W,78.77,21.23,M11,"M11 N11 N9 N12 J6 M9 H5 G6 N8 L9 L6 K9 M6",M11,M11 N9 M9 N15 N11 Q13 
76,B,81.46,18.54,D12,"D12 E11 C11 C10 C12 D9 E12 F11 F12 G11 C16 E16 E17 E15",N11,D12 N11 M16 N9 C13 E15 
77,W,77.55,22.45,N9,"N9 N12 M8 O9 O8 P8 E16 F15 J6 H7 J7 J5",N9,N9 N12 E16 N15 J6 J7 H7 M12 
78,B,79.01,20.99,N12,"N12 M8 O9 O8 P8 E16 L9 M9 L7 F15 C9 N15",N12,N12 O9 M9 M16 M12 
79,W,77.79,22.21,M8,"M8 O9 O8 P8 E16 L9 M9 L7 F15 C9 N15 N14 M14 M13 L13 L14",K7,M8 O9 K7 J6 J7 L6 M12 H7 L7 M6 
80,B,79.59,20.41,O9,"O9 N8 O8 E16 F15 E13 C9 H16 F13 F17 E12 D12 G17",L8,O9 E15 L8 M8 M16 M9 N8 M7 J9 
81,W,72.98,27.02,M6,"M6 N8 M9 O9 M8 L6 L7 K6 J6 J5 J7 G5 O8 P8 E16 F15 H16 G17 H17",K8,M6 K8 L7 H7 G6 M8 M12 
82,B,79.24,20.76,N8,"N8 M9 O9 E16 F15 M12 M13 L13 M14 C9 M8 H7 G7 H8",N8,N8 O9 L9 M7 M9 M8 L7 
83,W,77.86,22.14,M9,"M9 O9 E16 F15 M8 C9 J5 H5 D9 D8 C10 E9 D10 C8 E13",E16,M9 E16 H7 F6 G6 M8 H16 J4 O9 
84,B,82.02,17.98,M9,"M9 F15 H8 H11 C9 N15 G16 G15 H16 F17 M16 N17 G18 F18",F15,M9 F15 M16 H8 C9 E15 F17 L9 D10 E14 
85,W,75.48,24.52,M8,"M8 O9 M9 C9 J5 H5 N7 O8 J3 O5 H4 G4 D9 D8 C8 B10",H17,M8 M9 H16 J5 H7 F17 N15 G6 E13 M12 J4 C8 O9 H5 C9 F6 J6 H17 
86,B,80.78,19.22,G17,"G17 H16 H14 G14 H15 G18 G13 F17 G16 J18 D14 C14 D13",G17,G17 H16 E15 E12 M16 M9 F18 H8 E13 D14 E17 H15 L9 J14 G18 F17 
87,W,80.43,19.57,H16,"H16 H15 H18 J15 F17 M9 H7 G7 H8 D14 E15 E14 F14 F13 G14 G15",H16,H16 J16 M9 
88,B,81.73,18.27,H15,"H15 J15 H14 K14 L13 K13 L14 J12 J16 K16 J17 K17 J18 K18 H18 L18 C9 F18",H14,H15 E13 H14 M16 E12 E15 H18 D14 F13 H13 G13 G14 K18 
89,W,78.91,21.09,H18,"H18 D14 C14 M9 E14 F14 J14 J13 K14 K13 L14 L13 N15 M14 M15 J15",G14,H18 G14 K15 J14 M9 E13 N15 L14 M8 J15 
90,B,82.43,17.57,E15,"E15 C16 E13 G15 G13 H13 G12 J14 H12",E15,E15 D14 H15 G13 G15 H18 
91,W,82.67,17.33,C16,"C16 E13 G15 F12 G12 G11 G13 D14 F11 H18 J18 F18 H19 B15 E12 C15 E18",C16,C16 E17 
92,B,84.45,15.55,E13,"E13 F12 E12 E11 F13 G13 G15 G12 H15 L18 K18 M19 C13 J18 J12 J11 F10 F11 K12 L13",G13,E13 H15 G15 G13 
93,W,73.76,26.24,F14,"F14 E14 F13 H18 J18 F18 H19 G18 J17 G15 H15 J14 K15 L13",G15,F14 H15 H13 G15 H18 M9 J14 F13 K15 E13 M8 M12 
94,B,84.40,15.60,F13,"F13 H13 D13 H12 J14 K15 F11 K14 B13 D9 H18 J18 F18 H19 B15 C14 C13 B14",F13,F13 E13 H18 F14 
95,W,83.75,16.25,H13,"H13 D13 H12 J14 K15 F11 C13 K13 L13 H11 J12 K12 J11 K14 L15 L14",H13,H13 F14 
96,B,84.50,15.50,D13,"D13 H12 J14 K15 G11 K13 H18 J18 F18 H19 G18 J17 B13 B15 D9 E10 G9 E9 D8 E8",E13,D13 J14 E13 H12 D14 H18 D12 J15 J13 
97,W,82.37,17.63,H12,"H12 J14 K15 C13 K14 E10 M14 H18 J18 B15 E18 H11 G12 E11",H12,H12 J14 J13 
98,B,83.55,16.45,J14,"J14 K15 C13 K14 E10 N15 H18 J18 F18 H19 B15 G18 H11 G12 E11",J14,J14 C13 J15 C14 
99,W,82.82,17.18,K15,"K15 C13 K14 E10 N15 H18 J18 F18 H19 B15 G18 H11 G12 E11",K15,K15 H18 K14 
100,B,84.08,15.92,C13,"C13 K14 E10 M14 H18 J18 B15 E18 H11 G12 E11 G11 G10 G8 E8",K14,C13 H18 L13 K14 K13 H11 C14 M16 J13 J15 
101,W,78.99,21.01,L15,"L15 C13 F11 M16 L14 G11 G12 F12 F10 L13 M13 K12 L12 K13",L15,L15 L14 
102,B,80.97,19.03,C13,"C13 L14 H18 J18 B15 F11 F18 H19 G18 E18 M16 N17 M15",H11,C13 H18 M16 H11 K12 L13 J16 L14 M15 
103,W,78.48,21.52,G12,"G12 E11 G11 G10 H10 C14 L14 F10 B7 B6 B12 C13 C8 H18 J18 F18 H19",G12,G12 L14 J11 M15 J12 G11 K12 
104,B,80.75,19.25,E11,"E11 G11 G10 H10 F10 D13 K12 J11 M15 D12 F11 L18 K18 M19 H18 M14 N15 L14",E11,E11 L13 H18 F11 M15 M16 G11 J12 J15 J16 K12 L14 
105,W,80.96,19.04,G11,"G11 G10 H10 F10 L14 C13 H9 H18 J18 B15 G18 F18 H19 F8 G7 F7 G6",G11,G11 L14 M15 F11 
106,B,82.12,17.88,G10,"G10 H10 F10 L14 C13 H18 B15 H9 F8 G7 F7 G6 F4 B4 B5",G10,G10 L13 K12 C14 D12 J16 M16 H18 L14 M15 C13 E10 
107,W,81.36,18.64,H10,"H10 F10 J11 M15 L14 D12 O9 M9 N13 M12 N15 M16 N14 L13 M14 K12 H7",F10,H10 M15 F10 L14 D12 F11 L13 J11 K12 
108,B,83.89,16.11,F11,"F11 G9 H10 H9 E10 F9 M15 L18 C13 L14 L13 M14 K12 J11 N15 M19 M16 O9 M9 O8 N7 O7 N6 O6 O5 P5",E10,F11 E10 M16 G9 H10 
109,W,70.70,29.30,F9,"F9 M16 N17 M15 L14 L13 M14 N15 K13 C14 E9 D10 D9 C10",F9,F9 G9 L14 C13 M15 H10 F11 
110,B,72.32,27.68,M16,"M16 M15 N17 N15 C14 D14 D13 M17 B15 H18 N17 E9 D10 M17 E18",C14,M16 C14 F11 M15 K12 J16 L13 H18 C13 
111,W,70.21,29.79,M15,"M15 H18 J18 B15 G18 F18 H19 E9 F8 E18 E17 F17 C15 B13 B18 B16 D18 M12 F6",H18,M15 D14 L14 E9 N15 H18 C13 
112,B,76.86,23.14,M16,"M16 M15 N17 N15 O18 M17 F11 N17 H10 K12 H8 O9 M9 O8 N7 O7 N6 O6 O5 P5 P6 P10 S10",K12,M16 M15 E9 F11 L13 B15 E18 K12 J16 G18 
113,W,71.19,28.81,M15,"M15 J11 F11 M12 H7 E9 E8 D8 G6 D12 D7 C7 E7 C8",M15,M15 M12 L13 F11 M14 E9 J11 H10 
114,B,72.65,27.35,J11,"J11 F11 M12 L13 L12 D9 D10 C10 C11 E9 D12 H7 J9 H9 G8 G7 H8 F7 G9 J6 J4 B10 B15 F18",M12,J11 M12 E9 H8 J9 H10 
115,W,69.98,30.02,J11,"J11 E9 F8 B15 F6 G5 C9 E18 E17 G18 B16 J16 J15 H15 G16 F17 L13 C15 D14 C12 B18",J11,J11 L13 E9 F6 H10 H7 M8 
116,B,70.78,29.22,E9,"E9 F8 B15 F6 G5 C9 E18 E17 G18 B16 J16 J15 H15 G16 F17 L13 C15 D18 B18 E19 F18 A16 C12 A18 D7",E9,E9 H8 B15 L9 D10 
117,W,70.50,29.50,F8,"F8 B15 F6 G5 C9 E18 E17 G18 B16 J16 J15 H15 G16 F17 L13 C15 D18 B18 E19 F18 A16 C12 A18 D7",F8,F8 D14 M9 F7 C13 L13 F6 G7 B13 
118,B,70.57,29.43,B15,"B15 F6 G5 C9 C7 D12 E12 C13 B13 B12 D14 A13 B14 B7 E18 E17 G18 D18 H19 K18",H8,B15 H8 E8 B14 L9 D14 J15 
119,W,68.47,31.53,E8,"E8 D8 D7 C7 D14 D13 C13 C12 B13 B12 B14 J9 H9 J8 K9 J10 K11 H10 J12 F11",G5,E8 H9 F6 L13 M9 M8 H10 
120,B,69.88,30.12,H5,"H5 H9 L9 G7 G6 F6 F5 B12 B13 C12 C13",G6,H5 G6 E8 F4 H10 J9 F6 F5 
121,W,67.15,32.85,E8,"E8 D8 D7 C8 F5 F6 F4 H2 E5 E7 H5 J6 H9 B6 J3 J2",E8,E8 H9 F5 
122,B,68.30,31.70,D8,"D8 D7 C8 F5 F4 H5 J6 E6 J5 C7 B8 B7 H10 F11 D12 H4 J2",D8,D8 C9 J9 F5 H10 
123,W,68.40,31.60,D7,"D7 C7 F5 D6 E7 F4 D14 D13 C13 C12 B13 B12 B14 J9 H9 J8 K9 J6",D7,D7 H9 F5 M9 F6 
124,B,69.03,30.97,C7,"C7 F5 D6 E7 F4 L5 H5 J4 H10 H9 G9 H7 J9 G8 J7",C7,C7 C8 E6 F5 H10 J9 E7 
125,W,67.63,32.37,F5,"F5 D6 E7 F4 J4 F6 H9 B15 E6 E5 L6 H5 O9 M9 O8 N7 O7",D14,F5 L5 H9 C8 D6 F6 D14 M6 M8 E12 M9 F4 
126,B,72.45,27.55,D13,"D13 C13 C12 B13 B12 B14 J9 H9 J8 D12 E12 J10 K9 M9 L9 L11 O9 M8 M7",D13,D13 C12 H10 C9 J9 F11 
127,W,73.63,26.37,C13,"C13 C12 B13 B12 B14 J9 H9 J8 D12 E12 J10 K9 L9 M8 F5 F4 H5 J5 F6 D6 J4 K6 H3 B4 B3 A12 A13",F5,C13 H9 M9 B13 E12 M8 D9 F5 
128,B,73.57,26.43,E7,"E7 F7 D6 F6 H5 C13 C12 B13 B12 B14 H9 H4 J4 H10 J9 K9 H3 M9",F6,E7 F6 D6 H5 H10 F4 J9 B15 
129,W,60.33,39.67,F4,"F4 E7 G2 H10 H9 G9 F11 C9 H7 J7 G7 J8 J6 K6",M8,F4 C8 E6 H9 H7 C13 
130,B,71.72,28.28,M7,"L9 M9 L7 K9 L6 L10 O9 K6 E7 N7 O8 K3 J4 L5 M6 J5",M7,M7 L9 O9 H10 L7 J9 D6 E7 B15 
131,W,72.14,27.86,M9,"M9 L7 N7 K9 J9 L9 L10 J8 H9 G8 G9 F4 P9 Q9 P10 Q10 P11 O8 O9 O13 Q11 R11 Q8",E6,M9 E6 
132,B,70.45,29.55,D6,"D6 E7 E5 C8 D9 B7 C6 C9 C10 B10 B11 C11 B9 D10 B8 C10 F11 H9 B12 M9 O9 B14 B13 C15 C13 N7",D6,D6 E5 
133,W,70.25,29.75,E7,"E7 E5 C8 D9 B7 C6 C9 C10 M9 L7 B10 B11 C11 B9 D10 B8 C10 F11 H9 B12 K6 L9 H5 J5 H4 F4 J4",E7,E7 M9 
134,B,71.19,28.81,E5,"E5 M9 H10 H7 J7 F11 K6 D9 D10 C8 C10 L7 O9 N7 B15 F17 G16 G18 F4 M6 L6 O8 P8",E5,E5 F4 
135,W,71.73,28.27,C8,"C8 D9 B7 C6 C9 C10 M9 L7 B10 B11 C11 B9 D10 B8 C10 F11 H9 B12 K6 L9 H5 J5 H4 F4 J4",H5,C8 M9 H5 B6 L9 H9 
136,B,68.61,31.39,J5,"J5 J6 H4 M9 O9 N7 B15 O8 P8 J4 K5 L5 F4 M6 B4 K4 G4 K2",J5,J5 J6 F11 
137,W,69.56,30.44,J6,"J6 H4 M9 O9 N7 B15 O8 P8 J4 K5 L5 K4 K3 J3 K6 J4 H7 F4 G7 E18 C13 B13 C12 B12 B11 C10 C11 B10 B16 B14 E17 G18 F7 B4 B3",H4,J6 M9 H4 C8 
138,B,74.41,25.59,J4,"J4 H3 H2 J3 K3 J6 K6 J7 H7 J2 F4 L3 K5 L2 H9 F11 M2 C8 C10 B7 C6 D9 D10 H1 G2 K2 G4 K4",J4,J4 J6 K6 F4 H10 F11 J3 J9 
139,W,70.72,29.28,H3,"H3 H2 J3 K3 J6 K6 J7 H7 J2 F4 H1 G2 L3 K5 L2 H9 C8 D9 F11 H10 J12 M2 B7 C6 C9 E12 B11",H3,H3 C8 M9 J6 
140,B,70.40,29.60,H2,"H2 J3 K3 J6 K6 J7 H7 J2 F4 H1 G2 L3 K5 L2 H9 C8 D9 F11 C9 M2 O3 L7 M6 K4 M1 M9 H10 J12 G1 O8",F4,H2 F4 J6 K6 J3 F11 
141,W,68.69,31.31,J6,"J6 H2 J3 K6 J7 K3 H7 J2 M9 B14 O9 E18 E17 G18 P10 C15 D18 B16 B18 H19 K18 B4 B3",J6,J6 C8 
142,B,70.04,29.96,H2,"H2 J3 K6 J7 K3 H7 J2 M9 B13 O9 P10 F17 G16 G18 B4 B3 S17 R17 S16 B6 C8 B5 C4 A4 B15 B16",H2,H2 J3 H7 K6 J7 K3 H9 
143,W,66.11,33.89,H7,"H7 J3 G7 B15 M9 O9 F7 E18 C13 B13 C12 B12 C15 B14 E17 G18 B16 B4 B3 S17 R17 R16 S18 C9 B11",C8,H7 J3 M9 C8 D9 
144,B,53.02,46.98,D9,"D9 B7 C6 J3 K6 J7 K3 H7 J2 B11 C12 C9 C11 B12",D9,D9 C10 C9 J3 J9 
145,W,59.42,40.58,B7,"B7 C6 J3 K6 J7 K3 H7 J2 B11 B9 B13 C13 B14 M9 L9 M8 G7 G4 S16 S15 R16 Q17 Q18 R17 S17 S18 T18 S19 R19",J3,B7 J3 H7 M9 C9 
146,B,68.85,31.15,K6,"K6 J7 K3 B7 C6 H7 J2 B11 B9 B13 C13 B14 M9 L9 B4 M8 O9 B3 M9 S17 S16 F18 Q17 Q18 R17 S18 C12 B12 L6",K6,K6 K3 K5 F11 
147,W,69.19,30.81,J7,"J7 K3 B7 C6 H7 J2 B11 B9 B13 C13 B14 M9 L9 B4 M8 F1 E1 M9 S16 B2 B3 A3 A2 A1 B1 C1 G7 G4 B1 J15 J16 C1 M8 O9 B1 R17 S17 C1",J7,J7 B7 C9 
148,B,69.53,30.47,K3,"K3 B7 C6 H7 J2 B11 B9 B13 C13 B14 M9 L9 B4 S16 F1 E1 S15 M8 O9 R16 B2 B3 A3 A2 A1 B1 C1 R15 S14 B1 Q17 Q18 C1 G7 G4 B1 R17 S17 C1",K3,K3 F11 
149,W,69.70,30.30,B7,"B7 C6 H7 J2 B11 B9 B13 C13 B14 M9 L9 B4 M8 F1 E1 M9 G7 G4 M8 B2 B3 A3 A2 A1 B1 C1 S14 R13 B1 R17 S17 C1 O9 M9 B1 M8 A2 S16 Q17 R16",K5,B7 H7 K5 J2 C9 M9 K4 B12 
150,B,45.89,54.11,K4,"K4 H7 G4 G7 J2 M9 B15 O9 P10 B7 C6 B12 C12",K4,K4 F11 
151,W,41.18,58.82,H7,"H7 G4 G7 J2 B7 C6 B11 B9 B13 C13 B14 M9 L9 B4 M8 O9 B3 S17 R17 R16 S18 G18",H7,H7 K2 B7 
152,B,48.46,51.54,J2,"J2 B7 C6 B11 B9 B13 C13 B14 M9 G7 G4 L9 B4 M8 F1 E1 M9 S16 S15 M8 O9 B3 S17 R17 R16 S18 G18",J2,J2 G4 B15 B4 B14 B13 M9 J16 M16 Q17 J15 C13 E18 B12 B3 C15 G18 L9 R17 A4 O9 C12 K16 G16 C10 F18 C11 Q18 B5 L10 L5 A13 B7 A2 F17 E1 B6 B11 H15 B16 B9 S17 A16 B1 F1 B2 C9 A14 F11 G1 G19 R3 N15 S18 K2 E17 B8 G8 S3 L18 J12 B10 A5 J18 K11 S16 D18 D19 K18 K9 F19 A3 O8 M13 L12 J10 M14 O5 K17 D10 D12 G7 L11 L14 A12 E14 C4 L7 A15 L6 B17 H19 R16 L13 O13 O7 N7 A17 N6 C19 E12 O4 A18 S14 T4 P18 P13 N14 J17 E19 K13 L2 B18 C6 P5 J19 L3 O14 A10 O2 T17 T15 J9 A6 R9 C18 S15 S11 F12 O12 B19 P11 P14 K1 M6 F14 O6 O18 J13 P8 P7 Q8 S9 Q13 K19 R13 M2 A11 R15 H10 O3 P9 A8 N13 O11 P16 N19 T18 Q9 P10 R8 S13 O1 S12 S19 M19 L19 S7 P6 P15 T16 Q11 H9 R19 O19 R4 J1 Q19 R11 O10 T13 P1 N1 S10 P19 H1 P12 A9 A7 T5 Q12 T11 T8 Q10 L1 T6 T10 G2 M1 T12 Q3 C1 T14 D5 T19 R2 Q1 F3 T9 A19 F7 J8 A1 G9 
153,W,45.26,54.74,B7,"B7 C6 B11 B9 B13 C13 B14 M9 G7 G4 B4 G18 L9 M8 S16 S15 R16 Q17 Q18 R17 S17 S18 T18 S19 R19 R15",B11,B7 M9 B11 B12 G7 C9 
154,B,42.36,57.64,B15,"B9 B13 C13 B14 M9 L9 B4 M8 O9 B3 S17 R17 S16 L7",B12,B15 B9 B8 B14 B10 C9 C12 G16 B13 B12 C10 C13 J15 B7 J16 M2 M16 D12 C11 M9 F11 B4 G18 E18 A13 A12 R17 G7 K16 H15 Q17 B16 K18 O9 C15 G8 H10 B5 C6 F18 A14 N15 L9 S3 H19 B3 R3 E17 A11 A4 B6 B2 Q18 D18 F17 F19 F1 A5 A9 K9 L10 S17 G4 J17 E19 A2 J18 L18 B1 S18 J12 L6 D19 S16 A16 K11 J9 K17 B18 A15 T4 J10 F12 L5 A3 S15 L14 G19 E1 G9 A17 B17 H9 J13 C4 B19 D10 J19 M14 L12 C19 L13 N6 E14 A7 K19 L11 N13 K13 R16 O5 A6 L7 C18 O8 A18 N14 E12 A8 A10 L19 P9 P5 O7 N19 R19 Q13 M6 F14 O14 P8 O12 O18 G1 P11 P14 O4 N7 C1 O6 O2 M13 P18 S11 P16 R15 O19 S13 P13 O11 T18 O13 M19 O10 S12 O3 R13 P15 Q9 T16 T17 S9 S14 T15 Q8 R8 R9 Q10 Q11 J8 Q12 T5 T6 P7 P10 D5 S10 P6 T14 F3 P12 L3 P19 P1 O1 T13 M1 T11 R11 T8 T12 L2 N1 K2 T10 A1 Q1 R4 S7 A19 T9 Q19 K1 H1 S19 L1 G2 J1 T19 Q3 R2 F7 
155,W,44.09,55.91,B7,"B7 C6 C9 C12 C11 B10 A11 C10 B9 D10 E12 F12 F11 D12 A10 E12 B6 B5 A5 A4 A6 A8",C12,B7 M9 C12 C9 G7 
156,B,60.27,39.73,C13,"C13 B7 C9 C6 B9 M9 O9 F18 S17 R17 S16 B15 B14 N7 O8",C13,C13 B13 O14 P15 C10 B14 D12 B10 B9 B15 B8 C9 M16 J16 C11 S3 J15 F11 A14 R3 H15 M9 K18 G16 A11 B4 E18 K16 A12 J12 E17 C15 B7 F17 G7 Q18 A13 G18 F18 D18 J13 B17 B16 L13 L12 J17 B5 K11 M14 M13 Q17 G8 N14 D10 K13 N15 J18 A10 P5 F12 O9 O13 N6 L9 J10 N13 S15 T4 R17 O5 S16 L18 E19 P12 L11 C4 P18 J9 F1 Q13 P14 O10 A4 P8 B18 K17 F14 N19 S13 P9 P11 C18 H19 Q9 R13 L14 C6 P10 Q10 F19 G4 D19 O12 A17 Q11 L10 A16 L5 P13 A7 P16 S18 P7 S17 C19 N7 A15 E1 B3 R16 L19 S12 P19 O4 O11 O3 M6 E14 O18 A5 O6 J8 S10 J19 G19 R11 O2 R9 A3 E12 B6 O19 O7 B2 Q8 L7 T8 A6 S11 M19 B19 G1 T17 K1 A9 Q12 L6 S14 R15 K2 M2 B1 N1 P6 T15 A2 O8 A18 S9 M1 K19 Q19 J1 T11 S19 T6 A8 K9 L2 L3 D5 O1 L1 R8 T9 A1 F3 H10 R19 T16 H1 T5 T10 G2 Q3 F7 C1 R2 T12 R4 T13 P1 S7 T14 G9 H9 Q1 T18 A19 T19 
157,W,64.11,35.89,B7,"B7 C6 B13 B14 C9 A13 B9 E18 E17 G18 D18 J16 K16 B16 B17 C15 A16 A15 B15 H19 J18 B16 A17 M9 B15 K18 J19 B16",B7,B7 C9 B13 B9 M9 
158,B,70.25,29.75,C6,"C6 B13 B14 C9 A13 B9 E18 E17 G18 D18 B16 M9 C15 B17 F17 A16 B15 E19 F18 B18 C19 D19 A17 A18 J16 K16 H15 G16 J17 J18 K17 J15 K18 M16 L19 J19 K19",C6,C6 C9 C10 E18 B9 B10 B8 G16 B15 M16 J15 J16 B14 G18 E17 D12 F18 B6 M9 C15 H15 A15 A14 K16 B13 A16 B4 A13 B16 B5 D18 D19 R3 Q18 B18 F19 K18 K17 E19 R17 S3 L18 Q17 J17 A11 S17 N15 G19 H19 O9 A12 C19 A18 J18 C11 G7 A17 B17 B19 K19 S18 J12 A2 B1 S16 O7 N7 K11 T4 A10 S15 A7 R16 N6 N19 O8 O10 L12 G8 F12 A8 L19 O14 A5 J19 P5 P13 P14 P7 O5 A9 P19 P8 P12 P11 Q8 R9 M19 R13 S13 Q11 O11 P9 A3 Q12 R19 O6 Q10 G9 L7 R8 T15 T16 P10 O18 P18 S14 P16 S11 T17 H9 A4 Q9 R15 M2 A6 C1 P15 P6 N1 Q19 R11 S12 S7 T8 P1 O13 S9 T6 T9 O2 L2 C18 Q13 K1 T18 T11 A1 T13 Q1 J1 T12 T5 T14 S10 T10 M1 R2 O1 H1 T19 A19 L1 S19 
159,W,69.67,30.33,B13,"B13 B14 C9 A13 B9 E18 E17 G18 D18 B16 M9 C15 B18 F19 B17 K18 K16 H19 J19 J18 G19 D12 C11 H19 L13 K19 L12 O9 N14 O14",C9,B13 C9 M9 B9 C10 
160,B,62.36,37.64,B10,"B10 C10 A11 R13 S13 B9 C11 S14 Q13 B11 G16 A10 H15 M9 J16 K16 J17 K17 J18 K18 E18",B10,B10 B13 D12 E18 B14 A13 A12 
161,W,62.98,37.02,C10,"C10 A11 R13 Q13 B9 C11 Q12 D12 P13 S13 M9 O9 N14 O14 S14 Q13 B5 P14 B6 C4 B4 E18 E17 G18 G7",C10,C10 E12 A10 C11 B9 D10 F11 B13 D12 A12 K2 M9 E14 L3 F14 A11 G7 R13 A9 S14 Q13 O9 B6 L9 S13 B5 B4 C4 F12 S16 R2 F17 N7 O8 B14 F18 H10 B15 E18 R17 P15 T5 B16 T1 S3 H9 J9 A16 D18 B8 R4 Q1 Q3 C15 B17 J17 K17 P18 P1 T6 B18 L6 K16 O1 O2 R15 A8 J8 L11 K9 R3 G8 P8 L18 Q18 O7 N17 O6 P6 O5 A7 A15 L7 L14 Q8 O3 B3 O18 T4 S10 N14 A3 G19 F7 C18 R9 A6 P5 O4 J16 A4 C19 Q12 A18 T8 J13 F1 B1 N6 E17 P16 P13 J10 O19 S17 Q17 S12 A17 S18 A5 Q9 M1 G9 F19 S11 P7 G16 D16 O10 P14 P11 K18 A1 J1 O11 O14 J19 S19 E19 R8 P10 R16 J18 H15 T15 H19 G18 T19 T14 N15 T10 L10 B2 J15 L13 K13 M19 N1 A2 M2 Q19 E1 L12 T17 T13 M16 P9 K19 N19 K11 O12 B19 J12 D19 G1 O13 T12 L2 R11 P12 S15 C1 T16 T11 R19 L19 K1 L1 D2 T18 H1 M6 P19 M14 T9 A19 G2 N13 Q10 A14 A13 S9 L5 Q11 M13 
162,B,64.05,35.95,A11,"A11 R13 Q13 B9 C11 P13 D12 Q12 S13 M9 O9 N13 Q13 M13 L13 R13 M14 N14 Q13 P14 Q11 R13 N15 L14 Q13 B4 E18 R13 M16 N17 Q13 P12 P11",A11,A11 E18 
163,W,62.56,37.44,R13,"R13 Q13 B9 C11 P13 D12 Q12 S13 M9 O9 N13 M14 M13 L14 S14 Q13 L3 L5 R13 R15 S12 Q13 K2 G4 R13 N15 M16",B9,R13 S14 C11 M9 B13 B9 E12 G7 A10 F12 F14 E14 F18 S13 B5 D12 L3 Q13 K2 F11 E18 B6 P15 G18 L13 B4 C4 L9 S16 P16 O13 F17 R15 D10 O8 O9 P5 E17 S12 A12 A5 N7 N14 A3 B15 S15 S17 P13 A9 B3 R16 Q9 N13 M13 Q12 J15 P11 A6 P9 P12 O10 L6 O5 A7 S11 T6 A4 R9 Q11 B18 Q17 B14 J16 Q10 P8 L12 O6 M14 G16 P6 F19 O7 L7 C15 R11 P7 S9 F7 A15 O2 T14 P10 B2 L14 K13 A17 Q8 A13 N6 B16 L18 A18 L5 M6 E19 A14 O4 A8 D18 R17 B8 K18 N1 E1 N15 A2 B1 K16 A16 M2 R4 O3 O14 T4 T5 K9 T15 T10 T13 O1 N17 S10 S18 L1 L11 R2 L19 G8 J17 M16 D19 J12 J18 G19 T9 Q3 T17 C19 R3 F1 H10 T8 P14 Q18 H9 R8 C18 M1 M19 L10 P1 T16 O11 H15 T12 J13 K17 D16 Q1 B19 J8 S3 J1 O12 H19 B17 K19 G9 T11 J9 R19 C1 K11 N19 T18 H1 G1 T1 J19 L2 J10 O18 P18 G2 A1 K1 P19 O19 S19 Q19 A19 T19 D2 
164,B,61.11,38.89,C11,"C11 S14 D12 R13 R15 Q13 S12 S13 O13 Q12 S15 T12 T14 P11 O9 P9 Q10 O10 Q9 O8 M9",C11,C11 A10 
165,W,55.39,44.61,S14,"S14 D12 R13 R15 Q13 S12 S13 S15 Q12 O13 T12 T14 P11 O9 P9 Q10 O10 Q9 O8 M9 R9 Q8 S9 T9 T10 S11 Q11 O9 N14 P13",S14,S14 D12 L3 M9 B5 F14 K2 R13 E14 B6 N7 S13 L9 E12 P15 S16 L13 B15 Q12 S12 B4 N14 Q13 O13 C4 G7 O8 P16 O9 R15 O6 E18 D10 S17 S15 P9 L12 O10 E17 F18 P5 G18 F11 F12 K18 Q9 O7 R16 L7 R11 O14 S9 L6 P13 R17 P10 F17 M6 L11 Q10 O3 Q17 Q11 O5 Q8 A4 G16 K17 M13 B16 N6 N15 P12 T6 J15 L5 J12 F1 O2 P8 N13 B3 K13 P7 F7 H15 A7 O4 O12 O1 A5 B14 A3 S10 P14 C15 L14 A16 M2 B13 J16 O11 S11 J9 P11 K16 L10 J18 R9 M16 T5 L18 H9 M14 H19 G8 A6 D18 G19 P6 T17 J10 T14 H10 A15 T13 N1 J19 J8 R4 B19 A8 B18 J17 A13 K11 Q18 A9 E19 M19 M1 N17 A2 T15 F19 T12 G9 Q3 L2 K9 T10 S3 R2 D19 P18 A14 T4 J13 B17 T1 P1 T11 K1 N19 R3 L1 B2 T8 R8 B1 E1 A17 T18 K19 C18 G1 S18 C19 H1 O18 T9 Q19 Q1 T16 O19 P19 B8 A18 L19 A1 G2 J1 C1 A10 R19 D16 S19 A12 T19 D2 A19 
166,B,50.14,49.86,D12,"D12 R13 R15 S13 Q12 Q13 O13 S16 S12 M9 S17 R17 S15 T15 R16 T16 P13 S18 O9 B4 B5 F18 L7 L6 M6 G7",D12,D12 B11 R13 E18 M16 R15 G18 J16 G16 S15 
167,W,47.16,52.84,R13,"R13 R15 S13 Q12 Q13 O13 S16 S12 M9 E18 E17 G18 B4 S15 T15 B5 O9 S17 R17 R16 T16 T14 T13",R13,R13 M9 B4 
